Family,Genus,Species,CommonName,GrowthRate,HardinessZones,Height,Width,Type,Foliage,Pollinators,Leaf,Flower,Ripen,Reproduction,Soils,pH,pH_split,Preferences,Tolerances,Habitat,HabitatRange,Edibility,Medicinal,OtherUses,PFAF
Caprifoliaceae,Lonicera,villosa,"Mountain fly honeysuckle, Fuller's honeysuckle",slow,"[3, 4, 5, 6, 7, 8, 9]",1.5,,Deciduous Shrub,Deciduous,['Insects'],,April to May.,,Hermaphrodite,"['light', 'medium', 'heavy']","Mildly acid, neutral and basic","['Mildly acid', ' neutral', 'basic']",,,"Peaty or rocky barrens, bogs and bushy places, especially on limestone.","N. America - Newfoundland to Alaska, south to Pennsylvania, Wisconsin and California.",3,0,0,https://pfaf.org/user/Plant.aspx?LatinName=Lonicera+villosa
Fabaceae or Leguminosae,Lupinus,perennis,Sundial Lupine,,"[4, 5, 6, 7, 8]",0.6,,Perennial,,['Bees'],,June to July.,,Hermaphrodite,"['light', 'medium']",Mildly acid and neutral,"['Mildly acid', 'neutral']",Well-drained soil,,Grassy places in dry sandy soils.,"Eastern N. America - Maine and Ontario, west to Minnesota and south to Florida.",3,1,3,https://pfaf.org/user/Plant.aspx?LatinName=Lupinus+perennis
Lycopodiaceae,Lycopodium,clavatum,"Common Club Moss, Running clubmoss",,"[10, 11, 12]",0.1,1.0,Evergreen Fern,Evergreen,,,,,,"['light', 'medium']","Mildly acid, neutral and basic","['Mildly acid', ' neutral', 'basic']","Well-drained soil. suitable ph: mildly acid, neutral",,"Moorland, fields and pastures, it is rare in lowland areas.","Arctic and temperate zones of N. America, Europe and Asia; C. America; S. America; Caribbean; scattered through tropical Africa and tropical Asia.",0,3,3,https://pfaf.org/user/Plant.aspx?LatinName=Lycopodium+clavatum
Lamiaceae or Labiatae,Lycopus,uniflorus,"Bugleweed, Northern bugleweed",,"[4, 5, 6, 7, 8]",0.3,,Perennial,,"['Bees', 'Flies']",,,,Hermaphrodite,"['light', 'medium', 'heavy']","Mildly acid, neutral and basic","['Mildly acid', ' neutral', 'basic']",,,"Low, wet or boggy ground in the north of its range, wet woodland in the south.","N. America - Newfoundland to British Columbia, North Carolina, Nebraska and Oregon",3,1,0,https://pfaf.org/user/Plant.aspx?LatinName=Lycopus+uniflorus
Fabaceae or Leguminosae,Maackia,amurensis,"Chinese Yellow Wood, Amur maackia",slow,"[4, 5, 6, 7]",6.0,6.0,Deciduous Shrub,Deciduous,['Insects'],,July to August,October to November,Hermaphrodite,"['light', 'medium', 'heavy']","Mildly acid, neutral and basic","['Mildly acid', ' neutral', 'basic']",,,"Forests on hill slopes at elevations of 300 - 900 metres in Hebei, Heilongjiang, Jilin, Liaoning, Nei Mogol and Shandong Provinces, China.","E. Asia - China, northern and central Japan, Korea.",1,0,4,https://pfaf.org/user/Plant.aspx?LatinName=Maackia+amurensis
Magnoliaceae,Magnolia,virginiana,"Laurel Magnolia, Sweetbay",slow,"[4, 5, 6, 7, 8]",10.0,6.0,Deciduous Tree,Deciduous,['Beetles'],,June to September.,,Hermaphrodite,"['light', 'medium', 'heavy']",Mildly acid and neutral,"['Mildly acid', 'neutral']",Well-drained soil. suitable ph: mildly acid,Atmospheric pollution,"Wet acid sandy barrens and swamps at low elevations[184, 229]. Swamps, bays, low wet woods, savannahs; chiefly in coastal plain and lower piedmont from sea level to 540 metres.","Eastern N. America - Massachusetts to Florida, west to Missouri and Tennessee.",1,3,2,https://pfaf.org/user/Plant.aspx?LatinName=Magnolia+virginiana
Berberidaceae,Mahonia,aquifolium,"Oregon Grape, Hollyleaved barberry, Oregon Holly Grape, Oregon Holly",fast,"[4, 5, 6, 7, 8]",2.0,1.5,Evergreen Shrub,Evergreen,['Insects'],,January to May,August to September,Hermaphrodite,"['light', 'medium', 'heavy', 'heavy']","Mildly acid, neutral and basic","['Mildly acid', ' neutral', 'basic']",,,Mixed coniferous woods to 2000 metres. It is found in woods and hedgerows in Britain.,Western N. America. Naturalized in Britain.,3,3,3,https://pfaf.org/user/Plant.aspx?LatinName=Mahonia+aquifolium
Berberidaceae,Mahonia,repens,"Creeping Oregon Grape, Creeping barberry, Grape Oregon",slow,"[4, 5, 6, 7, 8]",0.3,2.0,Evergreen Shrub,Evergreen,['Insects'],,April to May.,,Hermaphrodite,"['light', 'medium', 'heavy', 'heavy']","Mildly acid, neutral and basic","['Mildly acid', ' neutral', 'basic']",,,"Hills and slopes, often in partial shade, usually on dry slopes.",Western N. America.,3,3,4,https://pfaf.org/user/Plant.aspx?LatinName=Mahonia+repens
Convallariaceae,Maianthemum,canadense,"Canada Beadruby, Canada mayflower",fast,"[3, 4, 5, 6, 7]",0.1,1.0,Perennial,,['Insects'],,May to June.,,Hermaphrodite,"['light', 'medium', 'heavy']","Mildly acid, neutral and basic","['Mildly acid', ' neutral', 'basic']",,,"Woods and recent clearings, often to the sub-alpine zone, in humus-rich slightly acid soils.","Eastern N. America - Labrador to Georgia, west to Tennessee and Iowa.",1,1,2,https://pfaf.org/user/Plant.aspx?LatinName=Maianthemum+canadense
Rosaceae,Malus,baccata,"Chinese Crab, Siberian crab apple",medium,"[2, 3, 4, 5, 6, 7]",15.0,15.0,Deciduous Tree,Deciduous,['Insects'],,April to May,October,Hermaphrodite,"['light', 'medium', 'heavy', 'heavy']","Mildly acid, neutral and basic","['Mildly acid', ' neutral', 'basic']",Well-drained soil,,"Open forested areas to elevations of 1800 - 3600 metres[51, 272].",E. Asia - N. China to the Himalayas.,2,1,2,https://pfaf.org/user/Plant.aspx?LatinName=Malus+baccata
Rosaceae,Malus,ioensis,"Prairie Crab, Prairie crab apple, Texas crab apple, Prairie Crabapple",slow,"[3, 4, 5, 6, 7, 8]",5.0,5.0,Deciduous Tree,Deciduous,['Insects'],,May to June,October,Hermaphrodite,"['light', 'medium', 'heavy', 'heavy']",Mildly acid and neutral,"['Mildly acid', 'neutral']",Well-drained soil,,"Open woods, thickets, pastures, along streams etc, with a preference for calcareous soils.","Central N. America - Indiana to Minnesota, south to Texas and Louisiana.",2,0,2,https://pfaf.org/user/Plant.aspx?LatinName=Malus+ioensis
Rosaceae,Malus,pumila,"Paradise Apple, Common Apple, Apple Tree",medium,"[3, 4, 5, 6, 7, 8, 9]",7.0,,Deciduous Tree,Deciduous,['Insects'],,April.,,Hermaphrodite,"['light', 'medium', 'heavy', 'heavy']","Mildly acid, neutral and basic","['Mildly acid', ' neutral', 'basic']",Well-drained soil,,Not known in a truly wild situation.,"Europe, including Britain, from Scandanavia south and east to Spain, Greece and S.W. Asia.",4,2,3,https://pfaf.org/user/Plant.aspx?LatinName=Malus+pumila
Malvaceae,Malva,alcea,"Vervain mallow, Hollyhock Mallow",fast,"[4, 5, 6, 7, 8]",1.2,0.8,Perennial,,['Insects'],,July to October,August to October,Hermaphrodite,"['light', 'medium', 'heavy']","Mildly acid, neutral and basic","['Mildly acid', ' neutral', 'basic']","Well-drained soil. suitable ph: mildly acid, neutral",,"Gardens, vineyards and waste places.",Europe. An occasional casual in Britain.,5,1,2,https://pfaf.org/user/Plant.aspx?LatinName=Malva+alcea
Malvaceae,Malva,moschata,Musk Mallow,medium,"[3, 4, 5, 6, 7, 8, 9, 10]",0.8,0.6,Perennial,,['Bees'],,July to August,August to September,Hermaphrodite,"['light', 'medium', 'heavy']","Mildly acid, neutral and basic","['Mildly acid', ' neutral', 'basic']","Well-drained soil. suitable ph: mildly acid, neutral",,"Grassy places, pastures, hedgebanks etc, especially on rich soils, avoiding acid soils.","Most of Europe, including Britain, south to N. Africa.",5,2,2,https://pfaf.org/user/Plant.aspx?LatinName=Malva+moschata
Trilliaceae,Medeola,virginiana,Indian Cucumber Root,,"[3, 4, 5, 6, 7]",0.3,,Perennial,,,,May to June,September,Hermaphrodite,"['light', 'medium']","Mildly acid, neutral and basic","['Mildly acid', ' neutral', 'basic']",,,"Rich woods, margins of swamps and bogs.","Eastern N. America - Nova Scotia to Ontario, Minnesota, Florida and Tennessee.",4,1,1,https://pfaf.org/user/Plant.aspx?LatinName=Medeola+virginiana
Fabaceae or Leguminosae,Medicago,sativa,"Alfalfa, Yellow alfalfa",medium,"[4, 5, 6, 7, 8]",1.0,,Perennial,,"['Bees', 'Lepidoptera (moths & butterflies)']",,June to July,July to September,Hermaphrodite,"['light', 'medium', 'heavy']","Mildly acid, neutral and basic","['Mildly acid', ' neutral', 'basic']",Well-drained soil,Drought,"Waste ground, avoiding acid soils.",Europe - Mediterranean. More or less naturalized in Britain[17].,4,3,4,https://pfaf.org/user/Plant.aspx?LatinName=Medicago+sativa
Lamiaceae or Labiatae,Melissa,officinalis,"Lemon Balm, Common balm, Bee Balm, Sweet Balm,  Lemon Balm",fast,"[4, 5, 6, 7, 8]",0.7,0.4,Perennial,,['Bees'],,June to October,August to October,Hermaphrodite,"['light', 'medium']","Mildly acid, neutral and basic","['Mildly acid', ' neutral', 'basic']","Well-drained soil. suitable ph: mildly acid, neutral",Drought,Waste places and derelict land near human habitations.,"C. and S. Europe, W. Asia and N. Africa. Naturalized in Britain.",3,5,3,https://pfaf.org/user/Plant.aspx?LatinName=Melissa+officinalis
Lamiaceae or Labiatae,Mentha,arvensis,"Corn Mint, Wild mint",,"[4, 5, 6, 7, 8]",0.5,1.0,Perennial,,['Bees'],,May to October,July to October,Hermaphrodite,"['light', 'medium', 'heavy', 'heavy']","Mildly acid, neutral and basic","['Mildly acid', ' neutral', 'basic']",,,"Arable land, heaths, damp edges of woods[5, 17].","Europe, including Britain, from Scandanavia south and east to Spain, N. Asia and the Himalayas.",3,2,3,https://pfaf.org/user/Plant.aspx?LatinName=Mentha+arvensis
Lamiaceae or Labiatae,Mentha,requienii,"Corsican Mint, Mint",,"[5, 6, 7, 8, 9]",0.1,0.5,Perennial,,['Insects'],,July to August.,,Hermaphrodite,"['light', 'medium', 'heavy', 'heavy']","Mildly acid, neutral and basic","['Mildly acid', ' neutral', 'basic']",,,Not known,"Europe - Mediterranean in Corsica, Sardinia and Italy. Occasionally naturalized in Britain.",3,2,3,https://pfaf.org/user/Plant.aspx?LatinName=Mentha+requienii
Lamiaceae or Labiatae,Mentha,spicata,Spearmint,,"[3, 4, 5, 6, 7, 8, 9]",0.6,1.0,Perennial,,['Bees'],,August to September,September to October,Hermaphrodite,"['light', 'medium', 'heavy', 'heavy']","Mildly acid, neutral and basic","['Mildly acid', ' neutral', 'basic']",,,"Roadsides and waste places, usually in damp soils and sunny positions[4, 16, 17, 37].",C. Europe. Naturalized in Britain.,4,3,3,https://pfaf.org/user/Plant.aspx?LatinName=Mentha+spicata
Lamiaceae or Labiatae,Mentha,suaveolens,"Round-Leaved Mint, Apple mint, Pineapple Mint",fast,"[5, 6, 7, 8, 9, 10]",1.0,0.8,Perennial,,['Bees'],,,,Hermaphrodite,"['light', 'medium', 'heavy', 'heavy']","Mildly acid, neutral and basic","['Mildly acid', ' neutral', 'basic']",,,"Damp ground that often dries out in summer, from sea level to 400 metres in Turkey.","S. and W. Europe, north to the Netherlands and east into W. Asia.",2,2,2,https://pfaf.org/user/Plant.aspx?LatinName=Mentha+suaveolens
Lamiaceae or Labiatae,Mentha,x piperita,"Eau De Cologne Mint,  Eau de Cologne Mint, Peppermint",fast,"[3, 4, 5, 6, 7, 8, 9]",0.3,1.0,Perennial,,['Insects'],,August to October.,,Hermaphrodite,"['light', 'medium', 'heavy', 'heavy']","Mildly acid, neutral and basic","['Mildly acid', ' neutral', 'basic']",,,"A natural hybrid, M. aquatica x M. spicata found in moist soils on the sides of ditches, roadsides etc in S. England[5, 17].",Britain.,2,2,3,https://pfaf.org/user/Plant.aspx?LatinName=Mentha+x piperita
Lamiaceae or Labiatae,Mentha,x villosa,"Apple Mint, Bowles' Mint",,"[4, 5, 6, 7, 8]",0.6,1.0,Perennial,,['Insects'],,August to September.,,Hermaphrodite,"['light', 'medium', 'heavy', 'heavy']","Mildly acid, neutral and basic","['Mildly acid', ' neutral', 'basic']",,,"Roadsides and in ditches in the S. and W. of England[5, 17]. Probably a hybrid, M. spicata x M. suaveolens.","Central and southern Europe, including Britain, Mediterranean region, Azores..",4,2,3,https://pfaf.org/user/Plant.aspx?LatinName=Mentha+x villosa
Boraginaceae,Mertensia,maritima,Oyster Plant,,"[3, 4, 5, 6, 7]",0.2,0.2,Perennial,,['Insects? self'],,June to August,July to September,Hermaphrodite,"['light', 'medium']","Mildly acid, neutral and basic","['Mildly acid', ' neutral', 'basic']",Well-drained soil,Maritime exposure,Shingle by the sea. Uncommon and declining.,"Throughout the temperate regions of both hemispheres, including Britain.",3,0,0,https://pfaf.org/user/Plant.aspx?LatinName=Mertensia+maritima
Rosaceae,Mespilus,germanica,Medlar,medium,"[5, 6, 7, 8]",6.0,6.0,Deciduous Tree,Deciduous,['Bees'],,May to June,November,Hermaphrodite,"['light', 'medium', 'heavy']","Mildly acid, neutral and basic","['Mildly acid', ' neutral', 'basic']","Well-drained soil. suitable ph: mildly acid, neutral",,"Woods and hedgerows[7, 17].",S.E. Europe to W. Asia. Occasionally naturalized in Britain.,4,1,1,https://pfaf.org/user/Plant.aspx?LatinName=Mespilus+germanica
Rubiaceae,Mitchella,repens,Partridge Berry,slow,"[4, 5, 6, 7, 8, 9]",0.1,0.5,Evergreen Shrub,Evergreen,,,June to July.,,Hermaphrodite,"['light', 'medium']",Mildly acid and neutral soils and can grow in very acid,"['Mildly acid', 'neutral', 'very acid']",Well-drained soil. suitable ph: mildly acid,,"Dry or moist knolls in woods, on sandy sub-strates.","N. America - Newfoundland to Florida, west to Texas and Minnesota.",3,3,4,https://pfaf.org/user/Plant.aspx?LatinName=Mitchella+repens
Saxifragaceae,Mitella,diphylla,"Mitrewort, Twoleaf miterwort",,"[3, 4, 5, 6, 7]",0.4,,Evergreen Perennial,Evergreen,,,May to June.,,Hermaphrodite,"['light', 'medium', 'heavy']","Mildly acid, neutral and basic","['Mildly acid', ' neutral', 'basic']",,,"Rich woodlands, meadows and swamps[200, 235].","Eastern N. America - Quebec to Minnesota, North Carolina and Missouri.",0,1,2,https://pfaf.org/user/Plant.aspx?LatinName=Mitella+diphylla
Lamiaceae or Labiatae,Monarda,didyma,"Bergamot, Scarlet beebalm, Horsemint, Oswego Tea, Bee  Balm",medium,"[4, 5, 6, 7, 8, 9, 10]",0.9,0.5,Perennial,,['Bees'],April to October,June to September,August to October,Hermaphrodite,"['light', 'medium', 'heavy', 'heavy']","Mildly acid, neutral and basic","['Mildly acid', ' neutral', 'basic']",,,"Moist soils in rich woods, thickets and bottom lands.","Eastern N. America - New York to Michigan, south to Georgia and Tennessee.",3,2,3,https://pfaf.org/user/Plant.aspx?LatinName=Monarda+didyma
Lamiaceae or Labiatae,Monarda,fistulosa,"Wild Bergamot, Mintleaf bergamot, Wild Bee-Balm, Lupine",medium,"[4, 5, 6, 7, 8, 9, 10]",1.5,0.5,Perennial,,['Bees'],,July,August,Hermaphrodite,"['light', 'medium', 'heavy', 'heavy']","Mildly acid, neutral and basic","['Mildly acid', ' neutral', 'basic']",,,"Dry thickets, clearings and woodland edges.","North-eastern N. America - Quebec to Minnesota, south to Texas.",3,2,2,https://pfaf.org/user/Plant.aspx?LatinName=Monarda+fistulosa
Moraceae,Morus,alba,"White Mulberry, Common Mulberry,",medium,"[4, 5, 6, 7, 8, 9, 10]",18.0,10.0,Deciduous Tree,Deciduous,,,May,July to August,Monoecious,"['light', 'medium', 'heavy']","Mildly acid, neutral and basic","['Mildly acid', ' neutral', 'basic']","Well-drained soil. suitable ph: mildly acid, neutral",Drought,Not known in a truly wild situation.,E. Asia - central and northern China.,4,3,4,https://pfaf.org/user/Plant.aspx?LatinName=Morus+alba
Moraceae,Morus,nigra,Black Mulberry,slow,"[5, 6, 7, 8, 9, 10]",10.0,15.0,Deciduous Tree,Deciduous,,,May to June,August to September,Monoecious,"['light', 'medium', 'heavy']","Mildly acid, neutral and basic","['Mildly acid', ' neutral', 'basic']","Well-drained soil. suitable ph: mildly acid, neutral",Atmospheric pollution,Original habitat is obscure.,W. Asia?,5,3,3,https://pfaf.org/user/Plant.aspx?LatinName=Morus+nigra
Moraceae,Morus,rubra,"Red Mulberry, Common Mulberry, White Mulberry",,"[4, 5, 6, 7, 8, 9]",15.0,,Deciduous Tree,Deciduous,,,May,July to August,Dioecious,"['light', 'medium', 'heavy']","Mildly acid, neutral and basic","['Mildly acid', ' neutral', 'basic']","Well-drained soil. suitable ph: mildly acid, neutral",,"Rich moist woods[43, 227]. Sunny places along the sides of roads. Plants do not grow well on poor soils.","Eastern N. America - Quebec to Florida, west to Texas and South Dakota.",3,2,2,https://pfaf.org/user/Plant.aspx?LatinName=Morus+rubra
Myricaceae,Myrica,cerifera,"Wax Myrtle - Bayberry Wild Cinnamon, Southern Bayberry, Wax Myrtle, Southern Wax Myrtle",fast,"[7, 8, 9, 10, 11]",9.0,3.0,Evergreen Shrub,Evergreen,['Wind'],,April to June,October,Monoecious,"['light', 'medium', 'heavy']",Mildly acid and neutral,"['Mildly acid', 'neutral']",Well-drained soil. suitable ph: mildly acid,,"Thickets on sandy soil near swamps and marshes, also on dry arid hills in which situation it is often only a few centimetres tall.",South-eastern N. America. Possibly naturalized in S. England[50].,3,3,4,https://pfaf.org/user/Plant.aspx?LatinName=Myrica+cerifera
Myricaceae,Myrica,gale,"Bog Myrtle, Sweetgale",,"[2, 3, 4, 5, 6, 7, 8, 9]",2.0,1.0,Deciduous Shrub,Deciduous,['Wind'],,March to May,August to September,Dioecious,"['light', 'medium', 'heavy']","Mildly acid, neutral and basic soils and can grow in very acid","['Mildly acid', ' neutral', 'basic', 'very acid']",,,"Bogs, marshes, fens and wet heathland in acid soils but plants are occasionally found in calcareous fens[5, 17, 186].","Western Europe, including Britain, from Scandanavia to Portugal, east to N.W. Russia. N. America.",2,2,4,https://pfaf.org/user/Plant.aspx?LatinName=Myrica+gale
Myricaceae,Myrica,pensylvanica,Northern Bayberry,,"[2, 3, 4, 5, 6, 7, 8, 9]",3.0,3.0,Deciduous Shrub,Deciduous,['Wind'],,April to May,October,Monoecious,"['light', 'medium', 'heavy']",Mildly acid and neutral soils and can grow in very acid and saline,"['Mildly acid', 'neutral', 'very acid', 'saline']",Well-drained soil. suitable ph: mildly acid,,"Dry or wet sterile soil near the coast. Coastal dunes, pine barrens, pine-oak forests, old fields, bogs, edges of streams, ponds, and swamps from sea level to 325 metres.",Eastern N. America. Possibly naturalized in Britain in the New Forest.,3,1,3,https://pfaf.org/user/Plant.aspx?LatinName=Myrica+pensylvanica
Apiaceae or Umbelliferae,Myrrhis,odorata,"Sweet Cicely, Anise",,"[4, 5, 6, 7, 8]",1.0,1.0,Perennial,,"['Bees', 'Flies', 'Beetles']",,May to June,July to August,Hermaphrodite,"['light', 'medium', 'heavy']","Mildly acid, neutral and basic","['Mildly acid', ' neutral', 'basic']",,,"Grassy places, hedges and woods in hilly regions, often near human habitations[4, 9, 17].","Mountainous regions of Europe, including Britain.",4,3,3,https://pfaf.org/user/Plant.aspx?LatinName=Myrrhis+odorata
Brassicaceae or Cruciferae,Nasturtium,officinale,Watercress,fast,"[3, 4, 5, 6, 7, 8, 9, 10, 11]",0.5,1.0,Perennial,,"['Bees', 'Flies']",,May to October,July to October,Hermaphrodite,"['light', 'medium', 'heavy']","Mildly acid, neutral and basic","['Mildly acid', ' neutral', 'basic']",Wet soil,,"Stream margins, ditches, flushes etc with moving water[17, 27], usually in chalk or limestone areas.","Europe, including Britain, from Sweden and Denmark south and east to N. Africa and W. Asia.",4,3,2,https://pfaf.org/user/Plant.aspx?LatinName=Nasturtium+officinale
Onocleaceae,Onoclea,sensibilis,Sensitive Fern,fast,"[4, 5, 6, 7, 8]",0.5,0.5,Deciduous Fern,Deciduous,,,,June to October,,"['light', 'medium', 'heavy']",Mildly acid and neutral soils and can grow in very acid,"['Mildly acid', 'neutral', 'very acid']",,,"Open swamps, thickets, marshes, or low woods, in sunny or shaded locations, often forming thick stands from sea level to elevations of 1500 metres,",N. America - east of the Rockies to N.E. Asia.,2,2,2,https://pfaf.org/user/Plant.aspx?LatinName=Onoclea+sensibilis
Cactaceae,Opuntia,compressa,"Eastern Prickly Pear, Prickly Pear Cactus",fast,"[8, 9, 10]",0.2,1.0,Evergreen Perennial,Evergreen,['Insects'],,July to August.,,Hermaphrodite,"['light', 'medium']","Mildly acid, neutral and basic","['Mildly acid', ' neutral', 'basic']","Well-drained soil. suitable ph: mildly acid, neutral",Drought,"Opn dry areas. Rocky bluffs, sand dunes, dry rocky or sandy grasslands.",North-eastern N. America. Naturalized on rocks and walls in S. and S.C. Europe.,3,1,2,https://pfaf.org/user/Plant.aspx?LatinName=Opuntia+compressa
Lamiaceae or Labiatae,Origanum,vulgare hirtum,Greek Oregano,,"[4, 5, 6, 7, 8]",0.6,0.6,Perennial,,"['Bees', 'Lepidoptera (moths & butterflies)']",,July to September,August to October,Hermaphrodite,"['light', 'medium', 'heavy']","Mildly acid, neutral and basic","['Mildly acid', ' neutral', 'basic']",Well-drained soil,,"Dry places in mountain regions in bushy places and on stony ground[50, 148].",S. Europe - Greece.,4,3,3,https://pfaf.org/user/Plant.aspx?LatinName=Origanum+vulgare hirtum
Apiaceae or Umbelliferae,Osmorhiza,claytonii,"Woolly Sweet-Cicely, Clayton's sweetroot",,"[5, 6, 7, 8, 9]",1.0,,Perennial,,['Insects'],,,,Hermaphrodite,"['light', 'medium', 'heavy']","Mildly acid, neutral and basic","['Mildly acid', ' neutral', 'basic']",,,Woods and wooded slopes.,"Eastern N. America - Nova Scotia to South Dakota, North Carolina, Illinois, Nebraska and Kansas.",3,1,1,https://pfaf.org/user/Plant.aspx?LatinName=Osmorhiza+claytonii
Apiaceae or Umbelliferae,Osmorhiza,longistylis,"Aniseroot, Longstyle sweetroot",,"[5, 6, 7, 8, 9]",1.2,,Perennial,,['Insects'],,June to July.,,Hermaphrodite,"['light', 'medium', 'heavy']","Mildly acid, neutral and basic","['Mildly acid', ' neutral', 'basic']",,,"Rich, often alluvial woods and thickets. Woods, often along the sides of streams in Texas.","Eastern N. America - Nova Scotia to Ontario, Alabama, Tennessee, Kansas and Colorado.",3,1,1,https://pfaf.org/user/Plant.aspx?LatinName=Osmorhiza+longistylis
Oxalidaceae,Oxalis,grandis,Great Yellow Woodsorrel,fast,"[5, 6, 7]",0.2,0.2,Annual/Perennial,,,,,,,"['light', 'medium', 'heavy']","Mildly acid, neutral and basic","['Mildly acid', ' neutral', 'basic']","Well-drained soil. suitable ph: mildly acid, neutral",,"Sandy woods, alluvial soils; 100–1100 m","Native to the eastern United States from Georgia north to Pennsylvania and Wisconsin, west as far as Louisiana.",2,1,1,https://pfaf.org/user/Plant.aspx?LatinName=Oxalis+grandis
Oxalidaceae,Oxalis,montana,Mountain Wood Sorrel,,[],0.1,0.3,Perennial,,['Insects'],,,,Hermaphrodite,"['light', 'medium', 'heavy']","Mildly acid, neutral and basic","['Mildly acid', ' neutral', 'basic']","Well-drained soil. suitable ph: mildly acid, neutral",,Damp woods.,"Eastern N. America - S. Newfoundland and E. Quebec to Manitoba, south to Wisconsin and Minnesota.",2,0,1,https://pfaf.org/user/Plant.aspx?LatinName=Oxalis+montana
Oxalidaceae,Oxalis,oregana,Redwood Sorrel,,"[6, 7, 8, 9]",0.2,,Evergreen Perennial,Evergreen,['Insects'],,May to July.,,Hermaphrodite,"['light', 'medium', 'heavy']","Mildly acid, neutral and basic","['Mildly acid', ' neutral', 'basic']","Well-drained soil. suitable ph: mildly acid, neutral",,Redwood forests. Moist woods.,Western N. America - Washington to California.,3,1,3,https://pfaf.org/user/Plant.aspx?LatinName=Oxalis+oregana
Oxalidaceae,Oxalis,violacea,Violet Wood Sorrel,,"[4, 5, 6, 7, 8]",0.3,,Bulb,,['Insects'],,May to August,July to September,Hermaphrodite,"['light', 'medium', 'heavy']","Mildly acid, neutral and basic","['Mildly acid', ' neutral', 'basic']","Well-drained soil. suitable ph: mildly acid, neutral",,"Woods, shaded slopes, gravelly banks and prairies. Dry sandy or clay soils.","Eastern N. America - New York to Wisconsin, south to Florida.",3,1,0,https://pfaf.org/user/Plant.aspx?LatinName=Oxalis+violacea
Polygonaceae,Oxyria,digyna,"Mountain Sorrel, Alpine mountainsorrel",,"[2, 3, 4, 5, 6, 7, 8]",0.5,0.3,Perennial,,['Wind'],,June to August,July to August,Hermaphrodite,"['light', 'medium', 'heavy']","Mildly acid, neutral and basic","['Mildly acid', ' neutral', 'basic']","Well-drained soil. suitable ph: mildly acid, neutral",,"Damp rocky places on mountains, especially by streams, avoiding acid soils. Locally common on enriched soils below bird roosts.","Mountains of the northern temperate zone, including Britain.",3,1,0,https://pfaf.org/user/Plant.aspx?LatinName=Oxyria+digyna
Buxaceae,Pachysandra,procumbens,Allegheny spurge,slow,"[5, 6, 7, 8]",0.3,0.6,Perennial,,,,,,,"['light', 'medium', 'heavy']",Mildly acid and neutral soils and can grow in very acid,"['Mildly acid', 'neutral', 'very acid']",Well-drained soil. suitable ph: mildly acid,,"Woodland with acid, well drained soils in shade or semi-shade.","Native to the southeast United States from West Virginia and Kentucky south to Florida, and west to Louisiana.",0,0,3,https://pfaf.org/user/Plant.aspx?LatinName=Pachysandra+procumbens
Araliaceae,Panax,quinquefolius,American Ginseng,slow,"[3, 4, 5, 6, 7]",0.3,0.5,Perennial,,,,June.,,Hermaphrodite,"['light', 'medium', 'heavy']","Mildly acid, neutral and basic","['Mildly acid', ' neutral', 'basic']",,,Rich cool woods.,"Eastern N. America - Maine to Georgia, west to Oklahoma and Minnesota.",1,3,0,https://pfaf.org/user/Plant.aspx?LatinName=Panax+quinquefolius
Araliaceae,Panax,trifolius,"Ground Nut, Dwarf ginseng",,"[3, 4, 5, 6, 7]",0.2,,Perennial,,,April to June,April.,,Hermaphrodite,"['light', 'medium', 'heavy']","Mildly acid, neutral and basic","['Mildly acid', ' neutral', 'basic']",,,Rich woods and damp clearings.,"Eastern N. America - Nova Scotia to Pennsylvania, west to Georgia, Indiana, Iowa and Minnesota.",1,2,0,https://pfaf.org/user/Plant.aspx?LatinName=Panax+trifolius
Asteraceae or Compositae,Parthenium,integrifolium,Wild Quinine,,"[3, 4, 5, 6, 7]",1.0,,Perennial,,['Insects'],,July to August.,,Hermaphrodite,"['light', 'medium', 'heavy']","Mildly acid, neutral and basic","['Mildly acid', ' neutral', 'basic']","Well-drained soil. suitable ph: mildly acid, neutral",Drought,"Prairies, rock outcrops and roadsides in arid and semi-arid environments.","Eastern N. America - Maryland to Minnesota and Georgia, as far west as Wisconsin and Arkansas.",0,2,0,https://pfaf.org/user/Plant.aspx?LatinName=Parthenium+integrifolium
